{
  "schema_version": "kaspascript.kernel.package.v0",
  "package_target": "tn10-toccata",
  "source_snapshots": [
    {
      "upstream_repo": "https://github.com/kaspanet/rusty-kaspa",
      "tag": "v2.0.1",
      "commit": "cfafeb4c093fa37a303f1b9f19c58f986b870ce3",
      "audit_date": "2026-06-17"
    },
    {
      "upstream_repo": "https://github.com/kaspanet/rusty-kaspa",
      "tag": "v2.0.0",
      "commit": "90dbf074275d60c1fe74a3491883196f110970c0",
      "audit_date": "2026-06-17"
    },
    {
      "upstream_repo": "https://github.com/kaspanet/rusty-kaspa",
      "tag": "v1.3.0-toc.5",
      "commit": "04b0d135f8c8023676ea74dcf496c99d5d0bc2a5",
      "audit_date": "2026-06-17"
    },
    {
      "upstream_repo": "https://github.com/kaspanet/rusty-kaspa",
      "tag": "tn10-toc3",
      "commit": "1015a62359e0d06e0b3b3b7f7d06bc1bd4bf0c1b",
      "audit_date": "2026-06-17"
    }
  ],
  "artifact": {
    "backend": "kaspa-txscript",
    "target": "tn10-toccata",
    "compiler_version": "0.1.0",
    "bytecode_bytes": 76,
    "finality_depth": 10,
    "kip_requirements": [
      10
    ],
    "contracts": [
      "Escrow"
    ],
    "spends": [
      "Escrow.release",
      "Escrow.refund"
    ],
    "application_schema_version": "kaspascript.application.v0"
  },
  "bytecode_hex": "057369675f61057369675f62520562757965720673656c6c6572076172626974657253ae6900c200bea26903736967056275796572ac690774696d656f7574b0516900c30562757965728769",
  "bytecode_asm": "OP_DATA_5 0x7369675f61 OP_DATA_5 0x7369675f62 OP_2 OP_DATA_5 0x6275796572 OP_DATA_6 0x73656c6c6572 OP_DATA_7 0x61726269746572 OP_3 OP_CHECKMULTISIG OP_VERIFY OP_0 OP_TXOUTPUTAMOUNT OP_0 OP_TXINPUTAMOUNT OP_GREATERTHANOREQUAL OP_VERIFY OP_DATA_3 0x736967 OP_DATA_5 0x6275796572 OP_CHECKSIG OP_VERIFY OP_DATA_7 0x74696d656f7574 OP_CHECKLOCKTIMEVERIFY OP_1 OP_VERIFY OP_0 OP_TXOUTPUTSPK OP_DATA_5 0x6275796572 OP_EQUAL OP_VERIFY",
  "kernel": {
    "schema_version": "kaspascript.kernel.package.v0",
    "blueprint": {
      "name": "Escrow",
      "network": "Tn10",
      "state": [
        {
          "name": "buyer",
          "ty": "PublicKey",
          "description": "compiled parameter from contract Escrow"
        },
        {
          "name": "seller",
          "ty": "PublicKey",
          "description": "compiled parameter from contract Escrow"
        },
        {
          "name": "arbiter",
          "ty": "PublicKey",
          "description": "compiled parameter from contract Escrow"
        },
        {
          "name": "timeout",
          "ty": "BlockHeight",
          "description": "compiled parameter from contract Escrow"
        }
      ],
      "transitions": [
        {
          "name": "release",
          "kind": "Spend",
          "consumes": [
            "input(0) referenced by source"
          ],
          "creates": [
            "output(0).value >= input(0).value"
          ],
          "signers": [
            "sig_a",
            "sig_b"
          ],
          "requirements": [
            {
              "feature": "BaseScript",
              "minimum_evidence": "BranchCode",
              "reason": "compiled artifact emitted verified Kaspa txscript bytecode"
            },
            {
              "feature": "WalletPreview",
              "minimum_evidence": "BranchCode",
              "reason": "kernel package emits wallet preview metadata"
            },
            {
              "feature": "IndexerLineage",
              "minimum_evidence": "BranchCode",
              "reason": "kernel package emits indexer schema metadata"
            },
            {
              "feature": "TransactionIntrospection",
              "minimum_evidence": "BranchCode",
              "reason": "artifact declares KIP-10 transaction introspection requirements"
            }
          ],
          "proof": {
            "verifier": "None",
            "public_inputs": [],
            "payload_hint": "no proof payload"
          },
          "wallet_warnings": [
            "Review `release` as a Kaspa contract spend path before signing.",
            "Source does not constrain the exact output count; review every additional output and recipient."
          ]
        },
        {
          "name": "refund",
          "kind": "Spend",
          "consumes": [
            "Escrow compiled locking state"
          ],
          "creates": [
            "output(0).script == buyer"
          ],
          "signers": [
            "sig"
          ],
          "requirements": [
            {
              "feature": "BaseScript",
              "minimum_evidence": "BranchCode",
              "reason": "compiled artifact emitted verified Kaspa txscript bytecode"
            },
            {
              "feature": "WalletPreview",
              "minimum_evidence": "BranchCode",
              "reason": "kernel package emits wallet preview metadata"
            },
            {
              "feature": "IndexerLineage",
              "minimum_evidence": "BranchCode",
              "reason": "kernel package emits indexer schema metadata"
            },
            {
              "feature": "TransactionIntrospection",
              "minimum_evidence": "BranchCode",
              "reason": "artifact declares KIP-10 transaction introspection requirements"
            }
          ],
          "proof": {
            "verifier": "None",
            "public_inputs": [],
            "payload_hint": "no proof payload"
          },
          "wallet_warnings": [
            "Review `refund` as a Kaspa contract spend path before signing.",
            "Source does not constrain the exact output count; review every additional output and recipient."
          ]
        }
      ],
      "evidence": [
        {
          "label": "KaspaScript compiled artifact",
          "url": "tests/contracts/escrow.ks",
          "audit_date": "2026-06-17T13:00:00Z",
          "network": "Tn10",
          "level": "BranchCode",
          "features": [
            "BaseScript",
            "WalletPreview",
            "IndexerLineage",
            "TransactionIntrospection"
          ],
          "note": "local compiler artifact verified before kernel package emission"
        },
        {
          "label": "rusty-kaspa v2.0.1",
          "url": "https://github.com/kaspanet/rusty-kaspa/releases/tag/v2.0.1",
          "audit_date": "2026-06-17T13:00:00Z",
          "network": "Mainnet",
          "level": "MainnetPreActivation",
          "features": [
            "TransactionIntrospection",
            "CovenantIds",
            "SequencingCommitments",
            "ZkVerification",
            "FeePolicy"
          ],
          "note": "mainnet Toccata maintenance release published 2026-06-15; usable as a drop-in upgrade version for v2.0.0 nodes and pre-Toccata 1.x nodes, with seq-commit lane-proof RPC and covenant-binding refinements; activation is still scheduled and not independently verified"
        },
        {
          "label": "rusty-kaspa v2.0.0",
          "url": "https://github.com/kaspanet/rusty-kaspa/releases/tag/v2.0.0",
          "audit_date": "2026-06-17T13:00:00Z",
          "network": "Mainnet",
          "level": "MainnetPreActivation",
          "features": [
            "TransactionIntrospection",
            "CovenantIds",
            "SequencingCommitments",
            "ZkVerification",
            "FeePolicy"
          ],
          "note": "mainnet Toccata release published 2026-06-05; activation is scheduled for DAA score 474,165,565 and is not active at this audit date"
        },
        {
          "label": "rusty-kaspa v1.3.0-toc.5",
          "url": "https://github.com/kaspanet/rusty-kaspa/releases/tag/v1.3.0-toc.5",
          "audit_date": "2026-06-17T13:00:00Z",
          "network": "Mainnet",
          "level": "MainnetPreActivation",
          "features": [
            "FeePolicy"
          ],
          "note": "mainnet sanity-testing pre-release; explicitly not mainnet activation"
        },
        {
          "label": "rusty-kaspa PR #1000",
          "url": "https://github.com/kaspanet/rusty-kaspa/pull/1000",
          "audit_date": "2026-06-17T13:00:00Z",
          "network": "Unknown",
          "level": "MergedCode",
          "features": [
            "TransactionIntrospection",
            "CovenantIds",
            "SequencingCommitments",
            "ZkVerification"
          ],
          "note": "Toccata implementation merged into master"
        },
        {
          "label": "rusty-kaspa tn10-toc3",
          "url": "https://github.com/kaspanet/rusty-kaspa/releases/tag/tn10-toc3",
          "audit_date": "2026-06-17T13:00:00Z",
          "network": "Tn10",
          "level": "TestnetActivation",
          "features": [
            "ZkVerification",
            "SequencingCommitments"
          ],
          "note": "TN10 Toccata ZK hardening activation evidence"
        },
        {
          "label": "KIP-17 merged file",
          "url": "https://github.com/kaspanet/kips/blob/master/kip-0017.md",
          "audit_date": "2026-06-17T13:00:00Z",
          "network": "Tn10",
          "level": "TestnetActivation",
          "features": [
            "TransactionIntrospection"
          ],
          "note": "merged KIP status indicates implemented and activated in TN10"
        },
        {
          "label": "KIP-20 merged file",
          "url": "https://github.com/kaspanet/kips/blob/master/kip-0020.md",
          "audit_date": "2026-06-17T13:00:00Z",
          "network": "Tn10",
          "level": "TestnetActivation",
          "features": [
            "CovenantIds"
          ],
          "note": "merged KIP status indicates implemented and activated in TN10"
        },
        {
          "label": "KIP-21 merged file",
          "url": "https://github.com/kaspanet/kips/blob/master/kip-0021.md",
          "audit_date": "2026-06-17T13:00:00Z",
          "network": "Tn10",
          "level": "TestnetActivation",